clean_text,sentimen
aplikasi force close  transaksi buffering  auto log out  gagal login  reset password gagal  kontak halobca gaada solusi  kurang apalagi minusnya  itu IT Team BCAnya tolong diaudit ya ,negatif
login my bca dan udah masukin password dg benar tapi malah ada notif kalau password salah  alhasil bca id jadi ke blokir,negatif
"Saya pengguna aplikasi BCA Mobile yang lama  menurut saya aplikasi lama memang ribet dan interface tidak mudah  but dependable

Belum lama ini banyak teman saya rekomendasi migrasi ke My BCA dengan alasan user friendliness  

Hari ini memutuskan untuk create account  dan stuck di halaman  setuju   agree  kepada terms and conditions mereka  Kenapa stuck  Hanya bisa scroll up and down tidak bisa di Agree ataupun Disagree  Saya coba kill app dengan pikiran mungkin error semata  ternyata sama saja selalu stuck di halaman terms and conditions

I can say that this app is not dependable  mau sign up aja susah  gimana kedepannya  Apalagi setelah membaca review user lain disini 

BCA PLEASE FIX THIS",negatif
Jadi susah bener mau masuknya  Ngcrash mulu  Tolong d benerin donk,negatif
Sore ini mau transfer tetapi aplikasi muter2  ternyata minta update  setelah update tetap cenderung lelet  saya cek aplikasi lain relatif normal  coba cek aplikasi apakah ada bug  Setelah face recognition pass masih muter2,negatif
I am new in this app and trying to set a new account to this app  I can t verify myself because the page couldn t load well  I ve tried my personal internet and 5 wifies  even using BCA office s wifi ,positif
Masih Sering lelet dan error dibanding dengan mobile banking,negatif
Force close  lemot  delay  intinya sudah parah update kali ini  Kalau disamakan sama aplikasi sebelah kalah jauh  Semoga update selanjutnya bisa diperbaiki dan lebih baik sampai bisa menyaingi aplikasi sebelah,negatif
Tidak lebih cepat dari m BCA  tolong perbaiki kecepatan sinyal di aplkasinya  Saya menggunakan sinyal yg sama ketika menggunakan aplikasi m BCA lebih cepat proses loading nya daripada myBCA ini  ada apa dengan myBCA   Satu lagi  tidak ada fitur pencarian nama seperti yg ada di m BCA  kenapa   Dari login sudah bagus bisa menggunakan face ID  tp kecepatan dan fiturnya masih kurang,positif
kebanyakan suruh update trs  baru bulan kemarin update disuruh update lg skrng buat pake fitur tf ke sesama bank bca  kdng sistem loading lama pula,positif
Maafkan  sejak update terakhir  MyBCA tambah lemot ya  sebelumnya responsif  langsung keluar angka dan daftar  tapi sejak update jadi butuh waktu bbrp detik baru keluar datanya ,negatif
Tiap mau transfer nyangkut terus  Loading lama  Akhirnya jadi kena 2x bayar  Ga usah banyak alasan  App ini paling tidak bisa diandalkan di saat2 penting  Habisin waktu doang ,positif
Lelet sekarang aplikasinya  ,negatif
Baru kali ini nemuin aplikasi bank untuk registrasi create account susah bener  Bolak balik otp  Udah kedaftar pas mau login balik lagi isi no hp  OTP lagi  muter muter terus  Hapus data yg terdaftar  email yg kedaftar diawal tetep ga bisa dipakai  bikin email lagi  Gitu aja terus  Sekelas BCA kok kayak gini aplikasinya  Tolong lah jangan malu maluin ,negatif
"Tolong di fix lagi My BCA di iPhone 8 sekarang jadi lemot 
Terimakasih",negatif
Gak bisa2 aktivasi  nmor hp dah di daftar ke mbanking  stiap login suruh minta kode otp  akhirnya gagal trus masuk ,negatif
Login sudah bisa face id,negatif
kalo mau log in  aplikasi force close,negatif
You put the wrong direct link update   it s direct to test flight not apps store,negatif
Baguss dan lebih fluid pemakaiannya,positif
Selalu pengajuan Pay latter BCA di tolak  ,negatif
yang mau pake aplikasi ini buat bayar qris  dipersiapkan sehari sebelum nya  saking lemot app nya,negatif
Dipakai susahh amatt  User experience nya agak lucu,negatif
"Keren aplikasi myBCA semua jadi lebih simpel  kita juga mau transfer apapun gak perlu lagi mesti save no rek tujuan bisa langsung satset 
Dan sudah ada face id nya  gak repot lagi ngetik pasword tiap kali login ",positif
Best mobile banking ever   aplikasi mudah digunakan  transaksi cepat aman dan lengkap dengan mybca  ,positif
Ini apps kayak belom siap tapi dipaksa launching  dari awal download sampe sekarang ga bisa dipake transaction failed terus karena kartu dan accountnya gagal ke bind walau udah coba berkali kali  sempet juga tiba tiba suruh regis ulang nomor telepon rupanya harus lewat atm  Ampun sedangkan apps lamanya cuma bisa 1 akun,negatif
Tolong dong jgn dikit dikit update  mau transfer aja hrs update mulu,positif
"jelek
menyusahkan nasabah",negatif
kenapa tabunganku tidak masuk ke myBCA ya ,negatif
Mantap superapps nya ditunggu fitur2 slanjutnya,positif
"Enak bgt
Udah setahun jg pindah dari BCA mobile
Skrg lebih lengkap firurnya",positif
"Ga repot udah Ada f t r Face ID 
Semua bisa di check di my BCA  Thank You for your service ",negatif
Tingkatkan fitur terus,negatif
App ini solusi bagi kami para nasabah,negatif
Aplikasi sangat membantu  jauh lebih baik dari versi sebelumnya,positif
Please add credit card limit remaining   let us set limit for every bca credit card thanks,positif
"Kenapa update terbaru belum ada fitur
Pembayaran qris lewat dana kartu kredit 
Semoga cepat ada biar kemana mana ngak usa bawa fisik kartu kredit lagi  Terima kasih",positif
Keren dan mantap utk semua fiturnya,positif
semoga kedepanya BCA kalau butuh otp buat transaksi debit online otp masuk ke aplikasi MYBCA yaa  biar kaya bank negara tetangga,negatif
cukup baik  mudah digunakan  tinggal tambah fitur top up masing2 e wallet  beserta saldonya tampil di halaman pertama ,positif
Simple Asik,positif
"Sumpah kecewa banget   aku nyesel download 
Hp ku jadi sering mati   dan Face id ku jadi rusak gara gara aplikasi ini yaAllah aku sakit hati banget   pas udah di hapus apk nya hp ku ga pernah mati lagi tapi FACE ID ku tetep rusak  ",negatif
Setiap habis update aplikasi mybca ataupun mbca  pas mau masuk pasti force close atau terpental  padahal belum login dll  hanya masuk aplikasi saja langsung force close,negatif
compact banget  fitur lebih nyaman di mata dan lengkap,positif
tombol ganti akun lainnya di simpen di bawah pasword jadi sering ke pencet dan malah jadi log out dan itu menyusahkan untuk login kembali dan perlu pulsa juga dari pengguna  saya lagi harus cepet cepet untuk transaksi jadi lama gara gara ini,positif
Makin kesini makin lemot aplikasinya buat transaksi  Loading super lama dan nggk nyaman banget,negatif
tambahkan informasi saldo pada halaman transfer  dan tambah koleksi produk reksa dana atau manajer investasi dengan return tertinggi,negatif
Setiap log in minta otp lagi  minta rekening lagi  minta ktp lagi  udah di penuhi  balik lagi ke otp  ktp   rekening  hadeh  dah lha hapus aja dr apstore dah paling bener pake m bca aja,positif
Udah daftar login tapi pas login suruh daftar lagi  kaga kelar kelar,negatif
Ribet daftarnya  harus ke ATM segala,negatif
"Setelah update loading berjam jam tidak bisa log in 
 Di ios ",negatif
Stlh update  face id sering eror dan bikin hp sy gabisa pake face id dan harus di restart  tolong dibenahi,negatif
Gila bgt nih app  Sampah  Kalo di gunakan saat urgent sangat tidak membantu  Jauh much better mbanking  Sekelas bca punya app sampah gini ,positif
Ini applikasi crash nya parah banget dah  Sudah buka  Mau transfer  Masukin rekening  Tiap kali ketik 1 angka  Dipaksa buat paste sesuatu dari whatsapp business  Sudah kita dont allow  Kita mau ketik lagi  Muncul lagi notifnya  Aneh banget dah,negatif
"Baru kejadian 15 November 2024 Ketika selesai transaksi dengan customer dengan qris terima  tiba  akun mybca terlogout  Saat ingin login ulang hingga halaman otp  otp pun tidak kunjung masuk  Setelah lapor via HaloBCA dibantu dengan blokir dan buka blokir  dilanjutkan dengan reset password  Seketika itu otp langsung masuk dan bisa login ulang dengan normal

Analisa singkat  ada bug pada sistem login dan ketika ingin login ulang  akun masih stuck pada session login sebelumnya  kemungkinan membaca perangkat menjadi perangkat berbeda  sehingga tidak bisa menerima otp",positif
padahal koneksi stabil udah pakai data seluler pakai wifi kadang masih lemot bgt buat login ataupun transfer tolong dong diperbaiki ,negatif
app terjujur ga pake buzzer buzeran  walaupun rating terendah tapi rating asli,positif
Jngn mohon maap aja tolong diperbaiki dan d tinjau setiap ada masukan  Cape hati suka TERBLOKIR SENDIRI ga salah password ga salah sinyal buang  waktu harus telp HALOBCA lagi minta data  ga jelas bilang gara  salah password 3x lah buang  PULSA padahal salah dari APP nya  ,negatif
Bisa dibuat fitur darkmode agar penggunaan ketika minim cahaya enk dipadang mata tidak silau,positif
Sering error n fail   payahh,negatif
Ketika lupa pasaword  sangat sulit untuk mengubah password bahkan sampai terblokir padahal user id sudah benar ,negatif
kartu kredit tidak tersambung  bolak balik cabang dan halo bca tidak ada solusi,negatif
It s so easy to use and yet very functional  Love it BCA Team,positif
Tampilan lebih clean,negatif
Tolong dong benerin   kok makin sini makin lemot apps nya   padahal sinyal bagus loh,positif
Orang mau nabung aja ribet bgt  emang e ktp aja ngga cukup untuk orang luar daerah  Harus domisili   Dikelurahan udah dipersulit  malah nambahin setan  Gw cuma pengen nabung doang hei  tolong permudah  Susahnya diluar daerah,negatif
fitur qris tap belum ada padahal udah diluncurkan sama ASPI agustus lalu tapi hingga versi 1 29 0 sekarang belum ada update juga  masak kalah sama bank biru yang sebelah ,negatif
Tolong di perbaiki saya baru daftar terjadi kesalahan terus saat login muncul verfikasi identitas dan selalu Oops terjadi kesalahan silahkan coba lagi begitu teruss ,negatif
Jelek banget  susah login  suka crash  dan lama banget buat scan qris bisa sampe 15 menit  Dan parahnya lg ini terjadi di iphone 15 promax,negatif
"Aplikasi lemot sekali

Device ip 11 14pro",negatif
"Business prosesnya ruwet banget  ga kaya mobile banking lainnya  saya punya 3 yg lain  dan semua jauh lebih mudah dr bca   Contoh 
1  Buka account baru ga bisa  saya sampai hrs ke cs 
2  Beli reksadana dolar  source of fund yg terlihat hanya 1  yaitu rupiah account  Sementara dolar account yang dibutuhkan untuk transaksi ini  tidak terlihat

Kontak cs  ga ada solusi juga  Masa hrs ke cabang terus2an  Buat apa ada mobile banking ",negatif
Pas login apk my BCA terjadi kesalahan mulu padahal hp udah di restart sama jaringan bagus stabil namu terjadi kesalahan terus  beda dengan kompetitornya BRIMO yg lebih modern dan canggih,positif
Pakai QRIS error  saldo berkurang  merchant gak terima dana  pakai transfer ke bank lain juga bermasalah  untungnya saldo gak kurang  Padahal sinyal internet bagus ,positif
Ini kenapa ya kode otp nya sama sekali tidak ada terkirim  sudah pakek nomor lain juga tidak masuk  tolong diberbaikii hal seperti ini,negatif
Aplikasinya masih sedikit berat  Jika dibandingan dengan Mandiri atau BNI  maka MyBCA masih lebih bagus  Tapi tidak lebih bagus dari BRImo  Mungkin pengembang bisa lebih memperhatikan loading data agar lebih cepat  Soal interface  sebenarnya tidak perlu terlalu wah  karena yang dibutuhkan user adalah kelancaran saat menggunakan App  bukan tampilan yang indah  BCA mobile tampilannya gitu2 aja  tapi luar biasa lancar ,positif
Selalu ke blokir setiap bulan padahal menggunakan face id tetep ke blokir terus,negatif
Internet connection 5G buy takes time to load QRIS  Lol cash faster,positif
Satu satunya aplikasi bank yang sering ngeblokir otomatis  Baru pakai satu tahunan  mungkin sudah 5 kali telpon call center untuk buka blokir  Kata call centernya karena biometrik pas login ngga pas  Padahal biometrik untuk unlocked hp  login app bank lain tidak perbah bermasalah ,negatif
Saran agar ditambah menu top up yang bisa langsung input no hp,positif
potonganya banyak banget,positif
"gagal masuk  ops terjadi kesalahan 
padahal wifi data aman",negatif
"Saya ada mobile banking dr bank2 sebelah dan jujurly the worst jatuh pada mybca 
Paling sering gangguan ga ada lawan dah",positif
Bagus banget tp kadan suka lemot kenapa ya    jadi lama kalo lg transaksi dan pas antri,positif
Lemot banget app nya,negatif
gajelas bca id di blok  udah ganti yg baru ttp gabisa masuk minta bantuan sm bca gadapet solusi apa apa wkwk kocak,positif
Notif gagal tpi transaksi berhasil  banyak kekurangan  ini aplikasi gagal  Harusnya gaperlu repot malah jadi ngepot ngurusin refund ,positif
TIDAK MENERIMA OTP PADAHAL NOMER AKTIF PULSA ADA sinyal bagus OTP DARI PAGI SAMPE SORE UDH COBA BERKALI KALI MASIH AJA TIDAK MENDAPATKAN OTP Mau login aja susahnya,positif
Every month this app suddenly blocked and i need to call halo bca to unlocked it  so weird they said and blame me input wrong password  helloowww iphone had password app that save all pass in all app even in browser ,negatif
APLIKASI MY BCA INI Selalu logout entah kenapa pihak dari BCA ketika saya minta solusi tidak dapat memberika solusi tiba tiba LOGOUT daN ITU ANEH  INI BUKAN PEMBARUAN DARI APLIKASI BCA AKHIRNYA SAYA KE APKIKASI BCA MOBILE KEMBALI,negatif
Ketika ingin login pertama kali dan di suruh tambahkan no hp masa kode negara bahkan negara indonesia sama sekali tidak terdaftar sehingga tidak dapat lanjut menggunakan apps ini dari sekian banyak negara indonesia sendiri tidak ada,positif
suka ke logout sendiri tiba2 jd perlu login dan perlu pulsa untuk dptin otp boncos deh setiap logout hrus beli pulsa dlu biar bs login mana sehari bs dua kali kelogout tb tb ,positif
Sudah telp halo bca berkali kali sampe datengin kantor cabangnya bersama CS nya nelp halo bca tetap gak ada solusi atas masalah saya  Malah disuruh buka rekening online  Padahal masalahnya bukan di rekening  Payah  Peringatannya no handphone sudah digunakan di mbanking  Kyak gini dibilang bank paling bagus ,positif
tidak bisa masuk rekening,negatif
Saya sudah melakukan penutupan terkait segala asuransi yang ada melalui halo bca dan proses sudah selesei 2 bulan yang lalu  Namun tiba tiba ada tagihan hari ini  sudah bocorin data nasabah  layanan gajelas pula,negatif
Knp suka logout sendiri nantik aktifasi pake pulsa lagi masak yaa dlm setahun aktifasi mbanking 3x,negatif
Di mybca tidak ada plihan negara indonesia kalau mau daftar bca id,negatif
Jujur sangat kecewa sama pihak bca buat laporan tnggl 2 sudah 25hri blm ada jga notifikasi dri bca nya,negatif
"Padahal udh pake aplikasi coba
 ",negatif
Mohon perbaiki server yang sering lambat,negatif
Mau masuk my bca nya susah mintak ampun  sudah isi bca id dan password malah muncul menu isi nomor handphone tapi gak ada kode indonesia sementara gak menu gak bisa kembali ke menu awal atau pilihan menu yg lain  di hubungi cs tapi cs gak guna pulak  bisa bisanya cs gak tau baru kali ini  gak ada solusi  sekelas bca kok seperti ini aplikasinya  buruk buruk sangat buruk,negatif
Mungkin terlalu banyak fitur di dalamnya sehingga pas buka aplikasinya gak secepat BCA mobile ,positif
Gagal membuka rekening baru karna alasan terdapat data yang tidak terbaca,negatif
Tolong diperbaiki yg bagian pd saat mau register no rek baru yg mau trf ke org  versi iphone  karena gk ada centang untuk save no rek baru pd saat mau trf  thanks,positif
Halooo developers  tolong dibuatkan aplikasi icon dan menu utama dark mode dong   Terimakasih,positif
Untun pertama kalinya sama tarik tunai di bank gagal namun saldo kepotong  agak kesal karena sudah menghubungi halo bca namun uang saya belum kembali,negatif
aplikasi sampah  suka ke blokir sendiri padahal lg ga buka aplikasi nya  cape telfon CS  setelah reset password diminta OTP berkali2 pakai pulsa sampe kepotong padahal OTP nya ga masuk dan cuma d kasih satu menit untuk masukin OTP  ANEH,negatif
Can t add international number  says they re upgrading the system,negatif
"as the title suggest   there s no  62 on country selection for phone number input

do the devs even test the app ",negatif
Baru juga bikin id nya   bisa pas mau kogin diblokir katanya   salah pasword aja engga   jadi bingung,negatif
"Gila ya potongan bca sampe 50 belom juga ak ambil duit udah habis duluan ortu ku kirim
Gk mikir
Bukannya mempermudah malah mempersulit",negatif
Tiap hari logout otomatis  harus setting ulang minta otp pulsa di potong terus 2000 rupiah  bagaimana ini bca,negatif
gabisa verif ktp jelek banget aplikasinya  sudah coba ke kantor pusat pun gaada solusi,negatif
"Pengkinian data lebih dari 24 jam  tidak di proses sama sekali
Disuruh cek email secara berkala tapi tidak ada sama sekali  saya disini kecewa sama cara kerja pihak bca ",negatif
Tiap mau login mencet face id ke tabrak sama pop up yg muncul malah jadi log out gitu terus mana login ulang make pulsa mulu taik lah bca trus tbtb id kblokir,positif
"Buat apa daftarin mybca harus ke KCP  malah ga diaktivasi sekalian
Bolak balik 3x cuma buat daftar mbca dan aktivasi biar bisa dipake",negatif
"gimana ini untuk update terbaru kok malah menyusahkan gini   pindah hp vc dulu lama banget dan berujung gak diangkt   
coba ini gimana keburu butuh masuk mybca nya jadi susah saat genting",negatif
Product information   term ga bisa di scroll buat klik agreement udah dari berapa bulan lalu ga ada perbaikan  Payah,negatif
Sudah hampir setahun gak bisa masuk BCA ID karena ID terblokir  Sudah hubungi call center tidak ada solusi juga  sudah 2 email saya gantung karena tidak bisa didaftarkan ,negatif
Best there s all we need for daily used  ,positif
Gabisa login gara2 katanya password salah  Ngaco pokonya,negatif
Bayar pake qris saldo ilang tapi ga masuk ke tujuan   ga cuma sekali dua kali  mohong di perbaiki kesalahan seperti ini merugikan bagi pengguna,negatif
Jangan download aplikasi ini guys  mending pake mbanking bca aja  Ini aplikasi gagal,positif
gajelas cuk aplikasinya  buat bayar tiket kereta ga kebayar  alhasil harus refund tiket,negatif
Saat saya memasukkan confirm new password  saya tidak bisa paste dari clipboard  Saya pakai aplikasi password manager untuk mempermudah  kenapa dipersulit untuk paste dari sana ,negatif
Awalnya bintang 5 tapi skrg bintang 1 dikarenakan uang yg saya transfer dari BCA ke shopee pay tidak terkirim dan sudah saya tunggu 12 jam tapi masih saja uang itu tidak ada dan hilang  Kecewa banget padahal saya sudah lama pengguna BCA,negatif
Tolong dibuatkan suara notifikasi untuk mybca biar lebih keren dan sama dengan bank yang lain,positif
udh berkali2 coba otp ga masuk2  sudah hub hallo bca dan ikutin smua arahan masih tidak bisa,negatif
Sejak ios terbaru malah lemot sekali dari login  pilih menu  semuanya ,positif
Abis di Update malah Keluar sendiri bikin ribet   masa sekelas BCA app nya masih banyak Bug,positif
Gak ada hari tanpa error  Mau buka apps nya aja mesti 2x  Open close open lagi baru bisa  Tiada hari tanpa error  lemot or ngehang  Pusing ,negatif
Setelah diupdate ke versi terbaru  malah tidak bisa login  Pesan errornya  terjadi kesalahan  silakan coba lagi   Entahlahh  katanya mau kuat di digital banking  tapi apps nya buruk ,positif
gajelasss salah apa  ngga diblokir,negatif
Gangguan mulu,negatif
padahal signal lagi bagus tapi loadingnya astaga bikin naik darah,positif
susah banget buat teansaksi padahal urgent banget,negatif
niat bikin appikasi gk sih eror mulu ampun ,negatif
Lemot total,negatif
Error mulu,negatif
"akhir2 ini kalau mau cek mutasi selalu di bilang melebihi batas yg ditentukan  apakah hanya app saya yg begini atau bagaimana  
untuk saya yg memang harus sering cek mutasi sangat merepotkan ",negatif
Kenapa sering ngelag dah buat transaksi   payah,negatif
"kok sering yah di perangkat ip mybca minta seperti login ke perangkat baru 
kan ribet harus sms kode otp lagi",positif
Kok beberapa minggu belakagan ini jadi lemot  knp ya ,negatif
UI nya modern tapi login ribet harus pake pulsa  bikin simple aja lah kaya BCA Mobile  Akhir akhir ini juga suka ke logout sendiri,negatif
bagus,positif
apk kocak,positif
m banking terburuk parah bgt kocak  masa kirim otp gabisa bisa tp pulsa kesedot  tolong pihak BCA perbaiki kocak,negatif
Capek banget sama cara login nya  Bikin ID BCA gampang ke blokir ,positif
akun sering terkeluar sendiri jadi boros pulsa buat login2 ulang ,positif
"Aplikasi nya lelet padahal sudah update versi terbaru 
Kl utk menu dan kegunaan lbh praktis tp sering loading lama 
Kedepan nya harus diperhatikan dari pihak aplikator",positif
Loading lama bgt untuk login pakai face id dan scan qris  Transaksi jadi gak satset  apalagi pernah sampai antri gara  loadingnya lama bgt  Please fix ,negatif
"Saya masih pakai ios jadul di ios12
Karna handphone di ios 12 untuk kerja dan belum ganti ke terbaru  tolong dong ios nya di mentokin di ios12 saja biar bisa di pake maaf b3",negatif
UI UX overall the best,positif
Yang saya tunggu di mbca notifikasi uang masuk tanpa syarat  Nah ini ada di myBCA  Mudah mudahan ada inovasi baru yg menarik lagi ,positif
lag  lemot,negatif
Tidak bisa login  sudah video call cust servis  Tidak bisa login tapi ada notif penarikan uang,negatif
Kenapa ya sering bgt my bca nya ke block padahal udah di setting pake face id  Sebulan sekali ada kali nelponin halo bca buat buka blockir,negatif
Sering error dan meminta kode OTP dengan menggunakan pulsa  sedangkan zaman sekarang pembelian pulsa sangat susah  Sekarang saya tidak bisa masuk lagi ke akun My BCA  Mohon sistemnya diperbaiki ,negatif
Aplikasi jlk bgt saldo tiba tiba ilang di mutasi gada keterangannya aneh,positif
Tolong tambahkan opsi untuk menghapus daftar transfer sekaligus seperti bca mobile  satu persatu dan harus masukin pin repot,negatif
Aplikasi ini sering error ketika login lambat   Qris sering gagal   terlebih Qris berkali kali   Saran saya untuk mybca Cukup fokus dengan urusan banking aja   tidak perlu ada promosi entah apalah itu   karena tiap update aplikasi semakin lambat dan yang di perbaharui hanya promosi nya  ,negatif
kadang tranksaksi gagal padahal sinyal bagus bca tolol,negatif
Terlalu lambat aplikasinya,negatif
Tambah lambat appny skrng,negatif
Seminggu an ini dipakai transaksi dan login lama loading nya  trus ini gabisa login berkali kali coba loading  pas udah login malah di blokir  kayaknya bug update os ya,positif
The app MyBCA runs too slow  Time is money  I don t have any experience with other bank applications  really hope you could do something about it  as we all are relying on it every single day ,negatif
Lemot bangettt  loading loading  masuk id password loading  klik menu transfer loading  masukin nominal loading  buka qris loading  masukin passowrd loading  selesainya jg loading  hadehhhh,negatif
napa jadi lemot dah  udh beberapa hari terakhir ini bayar qris aja loadingnya 1 2 menit sendiri  app cacat,negatif
lemottt,negatif
gimana sih inj,negatif
Kadang trouble males banget,negatif
Sering banget loading jaringannya dan lama untuk transaksi atau masuk ke menu pilihan pembayaran  Masih lebih baik dan simple Mobile BCA,positif
Asli beberapa kali lagi buru buru aplikasinya malah error ,negatif
sumpah makin lama app nya gajelas  lemot ,positif
Sering eror  apalagi akhir bulan,positif
Kenapa developer menghilangkan menu transaksi yang sering dilakukan di halaman depan  Sekarang jadi repot harus masuk dulu ke menu transfer baru pilih yang kita mau  jadi lebih ribet  kalau dulu kita tinggal pilih mau tranfer kemana tinggal pilih karena di halaman depan sudah langsung muncul ,negatif
Abisin pulsa terus,negatif
mobile banking paling mengecewakan  sangat menyulitkan nasabah karna harus pilih periode terlebih dahulu secara terus menerus jika ingin melihat transaksi mutasi  tidak muncul otomatis seperti yg lain  kendala sudah di sampaikan melalui WhatsApp namun juga tidak ada solusi  SANGAT MENGECEWAKAN ,negatif
kontl gajelas apk my bca kadang kadang suka logout sendiri  setiap mau login harus beli pulsa dulu   kadang sudah login abis itu logout lagi apk najis anjing,positif
tolong dong di perbaiki performa app nya,negatif
Kenapa akhir2 ini jadi lemot ya  loading mulu tiap akses mau apapun ituuuu,negatif
Aplikasi lemot  otp bayar  Bank sebelah otp gratis,positif
Nggk ngert lagi cara kerjanya ini,negatif
Tidak bisa dapat kode otp  padahal pulsa ada banyak banget,negatif
kode otp gak masuk masuk via sms hadehhh,negatif
"Tolong diperbaharui donk  lambat
Sekali sekarang prosesnya ",negatif
sumpah jangan daftar saldo setiap di transfer ilang setengahnya bahkan lebih,positif
Hi please have your own language setting on your apps  Don t push people to change their language on their phone it kind of a little annoying as I have to change phone language to understand what is written on your apps  I have tried to open my profile to check if you provide languages settings but sadly there is no settings for my concern thank you,negatif
gagal terus mau scan Qris  Lebih cepat dan stabil m BCA  Tolong di improve,positif
Apk sudah terhapus,negatif
Sebagai nasabah setia bca jujur saya kesal  Secara fitur memang lebih lengkap  tapi untuk load time better mobile banking sebelumnya  Apalagi kalo mau buru2 bayar pake QRIS  pr banget nunggunya  Jadi lebih sering pake payment gateway yang lain  Semoga bisa segera diperbaiki,positif
kalo orang lagi transaksi  jangan crash mulu  kenapa si aplikasi orang indo kek taek ,negatif
Always get blocked every once a month always get blocked  Never input the wrong password yet always blocked  Always use the face ID  but also keep getting blocked  Please fix this situation ,negatif
tambah fitur transaksi qris tanpa pin dong kaya di bca mobile ,positif
No loading screen  and incoming fund notification,negatif
Tidak bisa di percaya,negatif
Sekelas bca eror terus sampe un instal my bca sama mbangking bcanya,negatif
Mohon bantuannya saya 2 kali pengisian flazz dari My BCA gagal  Terdapat keterangan tunggu 24 jam untuk pengembalian dana tapi belum ada  Mohon bantuannya,negatif
saya mau cardless buffering terus padahal sinyal bagus  saya pindah ke BRI mulai hari ini,positif
Lemot mau masuk app untuk bayar qris saja susah sekali,negatif
Goblok  Saldo gw jadi 0,negatif
