clean_text,sentimen
Knp klo abis di abgred susah masuk ke menu dan lemot dari pertama download cepet,negatif
tolong diperbaiki untuk kota cirebon kenapa tidak ada kecamatan Kesambi saya jadi gabisa buat rekening ,negatif
Puas,negatif
 ,negatif
Mantap,positif
Menarik  Mudah digunakan,positif
Sangat bagus,positif
Sering keluar sendiri saat mau reset password,negatif
Mantap respon di hallo BCA juga sangat ramah dan pelayanan super cepat dan baik makin nyaman menggunakan BCA semoga BCA ke depan nya lebih maju lagi dan sukses,positif
Terima kasih panduan untuk menonaktifkan Aksesibilitasnya supaya dapat membuka aplikasi MyBCA  Luar biasa cepat respon pelayanannya  Aplikasi versi 1 28 1 berjalan mulus di Android 12,positif
Cukup membantu  ,negatif
Baru kemarin di update masak udah suruh update lagi  m banking ana dulu hampir gk pernah suruh update  menyesal kalau kayak gini mending lamai m banking aja gk makan banyak memori tgl 18 Oktober 2024 baru aja di update skrg sudah suruh update lagi,negatif
Gajelas malah keblokir wkwk pulsa kepotong abis ga dapet apa apa,negatif
Udah selesai daftar pas mau login balik lagi ke awal masukin no hp dll ,negatif
Sangat membantu  ,positif
Saya tidak bisa masuk ke my BCA mentok ke login aja,negatif
Ok,positif
AKSESIBILITAS AKSESIBILITAS APAAN SI GOLOBK  GAADA QC KAH PAS MAU DEPLOY KE PROD  LO KALO UPDATE TERUS NGEBUG YA BENERIN DONG ,positif
Ketika menu Aksesibilitas aktif  tidak bisa masuk,negatif
Sangat membabtu,positif
  Aplikasi ini sudah bagus  Saya lebih senang pakai ini  tapi saya juga tetap pakai BCA Mobile    SARANKU PAYLATER BISA DIBAYAR SENDIRI BEGITU TAGIHAN KELUAR TANPA HARUS NUNGGU DI DEBET OTOMATIS tiap tanggal 26 ,positif
Top,positif
ok sudah bisa kebuka aplikasinya  ,positif
Kenapa setelah di update tidak bisa di buka dan aplikasinya force close terus,negatif
kok bikin kesel setelah di upgred mlah gk bisa dibuka nyesel bgt,negatif
Saya tidak bisa akses login myBCA  Tertulis harus mengaktifkan aksesibilitas  Apakah benar  Terima kasih,negatif
Setelah di update jadi tidak bisa dibuka aplikasinya,negatif
Aplikasi simple  dan memuaskan,positif
Bagus,positif
Mempermudahkan semuanya    Moga my bca sllu kasi yg trbaik  ,positif
Gila udh ampir 10thn jd nsabah BCA giliran ngajuknn pay later malah ditolak,negatif
Bca bank mantap dan sukses terus,positif
Notifnya lambat ya masuknya tolong diperbaiki donk khususnya jika menerima transferan,negatif
Sangat mudah di gunakan bagus tapi ga ada pitur buat top up e wallet coba kalu ada lebih jos,positif
Good,positif
Update nya jangan keseringan  seminggu bisa 2 kali update,positif
Punya saya ga bisa masuk  Gara2 versi terbaru  Harus menonaktifkan aksebilitas  Padahal tidak ada yg aktif,positif
Tidak bisa nerima otp Udah berbulan bulan di coba,negatif
Mantab  mudah gak ribet,positif
Kasih notif kalo m banking offline ,negatif
Fitur lebih lengkap,positif
  Force close  Tertanggal sekarang   Permasalah sebelumnya sudah teratasi  Thanks,positif
Ga guna,negatif
kenapa setelah saya update ke versi terbaru  ketika saya login selalu mental  force close apk    sudah saya uinstal app  dan instal lagi hasilnya nihil  ,positif
Apknya bagus  cuman kalo bisa ditambah fitu darm mode,positif
Saya masukkan dana dari aplikasi Lalamove ke myBCA   kenapa saldonya berkurang   Ditengah bulan tiba2 ada biaya admin tanpa ada transaksi  ,negatif
Notifikasi rekening masuk tapi saldo nya ga masukk gimana sih ni,negatif
Sangat baik dan mudah dipergunakan nya,positif
Sangat merepotkan tidak bisa di buka di suruh nonaktivkan aksesibilitas padahal sudah tidak aktiv tapi tetap saja harus di non aktifkan aksesibilitas padahal statusnya tidak aktiv,positif
Setelah di update nggak bisa dipake Code otp tidak masuk sejak 3hati yg lalu ,negatif
Verifikasi sms berbayar dan verifikasi wajah yang kadang sangat sulit sehingga harus vidcall  dan adanya masalah aksesibilitas  masa hanya karna aplikasi sdm id aksesibilitas on aplikasi force close  Saran saya ada opsi kirim email untuk verifikasi perangkat  bukan sms dan untuk verifikasi wajah diberi pembatas wajah agar lebih mudah,negatif
Update terbaru tidak bisa dibuka karena aksebilitas,positif
Setelah 4 hari gak bisa akses Meskipun sudah bongkar pasang aplikasi Akhirnya skrng udh bisa Ternyata karena fitur aksesibilitas hp fi aktifkan jadi gk bisa login ke aplikasi Setelah di nonaktifkan akhirnya normal kembali,positif
Terbaik saat ini,positif
Aplikasi BCA Mobile dan myBCA nya ke force close terus  gaada solusi juga mending gausa di update deh kalo gini nyusahin pengguna aja  ,positif
MANTAP,negatif
Kenapa jadi ikut ribet juga seperti BCA Mobile  Kok jadi ngurusi aksesibilitas perangkat handphone juga  Padahal aplikasi perbankan yang lainnya ga sampai segitunya  Please balikin ke pengaturan yang lama saja deh  Ini sangat menyusahkan banyak nasabah BCA yang masih membutuhkan fitur aksesibilitas di handphonenya  Sorry  harus kasih rating satu karena kurangnya pemahaman terhadap kebutuhan nasabah mobile ,positif
Eror mau masuk nda bisa,negatif
Padahal Aksesibilitas sudah non aktif msih aja ga bisa masuk kedalam aplikasinya,negatif
oke,negatif
gabisa di buka hadeh,positif
Suka sekali,positif
User interface   menunya kurang friendly  tdk tersedia menu untuk top up e wallet langsung   kalau mau topup2   bayar masih harus daftar manual di menu Transfer   Virtual Account    harus cari kodenya dulu di google  ini tidak praktis  masih tertinggal dr Livin  brimo  bale   wondr  sekelas bank BCA harus terus inovasi seperti kompetitor bank Bumn ,positif
Serbaguna poko nya deh Gx bakal nyesel km dwonload juga,negatif
Bca mobile ga prnh ada kendala d setor tunai tnpa kartu  my bca kendala mulu tiap mau setor tunai  tiba2 apk kluar sndri,negatif
My BCA makin jelek aja  kode otp ga ke kirim  mana nyalahin user Mulu padahal user udah ngikutin arahan  aplikasi nya makin lemot  suka sering eror lagi  jelek banget sumpah my BCA sekarang,negatif
Aplikasi ajing yg sangat buruk sering keluar susah masuk lagi harus datang ke cabang menyita waktu bekerja  BCA babi,negatif
Sayang sekali  padahal sebelumnya semua lancar  aja  kenapa sekarang harus non aktifkan accessibility  Padahal aplikasi di hp kan banyak bukan cuma myBCA  Sungguh merepotkan ,positif
Ok,positif
Baik,positif
Knp semenjak mke my bca buka aplikasi ny g mau masuk mnding yg dlu g ada kendala lho,negatif
Oke,positif
Selamat pagi kak Mohon bantuannya aplikasi My BCA saya kok mental terus gk bisa login,positif
MANTAAAP,negatif
apasi tiap  ke potong mulu duit gue gada penjelasan tiba ilang anj9,negatif
Kurang Puas,positif
Opsional,negatif
Aplikasi gak bisa dipakai  Padahal udah enak  pakai apikasinya  Bank sebelah enak juga transaksinya  jd pindah deh,positif
Terimakasih sudah tau titik problemnya kenapa ga masuk masuk  Alhamdulillah sudah normal kembali,positif
Kok sering close sendiri ya,negatif
Banyak yang force close di versi terbaru  Lapor udah tapi masih sama  Mendingan kemarin ngga usah di update ,positif
Cuman ngasih otp setelah itu gagal masuk  tidak menyelesaikan masalah malah bikin ruet  yang bikin aplikasi cuman menghabiskan pulsa saja  berulang ulang kode otp terus sampai habis pulsanya tidak bisa  besuk,negatif
Mantap,positif
V1 28 1 Kenapa ada masalah force close sekarang  ,negatif
bagus tampilanya,positif
Sangat bagus sekali saat transaksi,positif
Bagus  ,positif
Knapa kalau sudah mau  Masuk terus keluar  Lagi dengan  Tiba ,negatif
parah  update versi koq msh nge bug force closed  hubungi cs juga cm suruh nunggu  accesbility dah off jg sama aja  ITnya bs kerja gak ,negatif
Tolong di update Aplikasinya   selalu di force close saat login   gak bisa di gunakan sama sekali karena selalu force close aplilasinya,negatif
Ini kenapa sih eror terus beberapa bulan kebelakang  Ini sekarang malah gak bisa masukmasuk selelu kelempar keluar lagi setiap login,negatif
TOP  ,positif
tar tambahin lg mau coba dulu,positif
Aplikasi nya force close terus setelah update,negatif
Sementara saya kasi 1 aja  aplikasi hang terus Menghambat kerjaan saja,negatif
Tolong gimana caranya biar saldo yang pending di BI fast BCA bisa di kembalikan   mana gak ada live chat buat konfirmasi tolonggg banget pihak BCA  ,positif
Knp sih saldo nya ko suka ke ambil aja ,positif
Mohon bantuannya admin aplikasi My BCA  Ini kenapa setelah di update aplikasi pertanggal 24 Oct 24 jam 9 pagi s d malam jam 20 00  Aplikasi malah tidak bisa di buka  Selalu force close dengan sendirinya  Problem ini saya merepotkan saya dan merugikan saya  Mohon dibantu agar bisa segera di update lagi supaya saya bisa pakai aplikasi ini lagi  Ditunggu  Sebelumnya terimakasih  Salam Denny Putra,negatif
Force close Mulu,negatif
Update mulu perasaan  ,negatif
Aplikasinya dikit2 minta update buat repot,negatif
Masih force closed stelah login  udah install ulang juga kendalanya sama  mohon pencerahan bosku ,negatif
Aplikasi gak jelas verifikasi muka gak kebaca  padahal udah ditempat terang mau seterang apa lgi masa gua harus verifikasi dibawah bulan gila lu,negatif
Update terbaru jadi jelek Buka My BCA selalu force close app  aplikasi tidak dapat di buka  Harus menonaktifkan fitur Accessibility Service Jadi agak ribet soal ada aplikasi yg lain selalu minta aksebiltas di aktifkan ,negatif
Di update malah keluar terus hedeh,positif
Keren ,negatif
2 hari ini gak bisa login aplikasi  selalu force close  Sudah di clear cache  clear data bahkan install ulang aplikasi  Masih saja gak bisa login  Tolong berikan solusi nanti bintang saya perbaharui,negatif
Update terbarunya nyusahin org  Susah login  pas login bs tiba  close sendiri,negatif
sebelumnya aman tiba tiba force close terus di uninstall h sekarang ga bisa login,positif
ini knp force close trs ya padahal udh update versi terbaru udh beberapa hari keluar trs klo mau login  segera ditindak deh  lumayan menyengsarakan soalnya ,negatif
Force close min,negatif
Force close mulu pas login anehh padahal lagi dibutuhin,negatif
Kenapa saya ga bisa masuk ke aplikasinya  ,negatif
Ini kenapa sih setelah di perbarui malah error  saya jadi tdk bisa login dan akhirnya terblokir  tolonglah apk ini kebutuhan sehari  karna ada uangnya  2 hari saya jadi tdk bisa transaksi krn setiap masuk tiba  apk nya keluar sendiri,negatif
Habis update malah force close,negatif
luar biasa keren bengat top bgt,positif
Tolong donk d perbaiki ketika akun id terblokir bisa d selesai kan dg cara lain tdk melulu nelpon halo bca mana telpon halo bca mesti pake pulsa lagi  ,negatif
Setelah apdet gak bisa masuk ke menu langsung close dan keluar sendiri setelah masukin ID nya itu kenapa ya min biasa lancar  aja,positif
Aduuh  di update malah force down  tolong dong bca,negatif
Sangat bagus di MyBCA transaksi mudah dan flexible,positif
tidak bisa login,negatif
beberapa kali sampai bosan telp halo BCA dari yang ramah sampai yang ngegasss  myBCA saya selalu muncul notifikasi untuk reset pasword dan sudah beberapa kali ganti dan reset  masih muncul notifikasi tersebut    stelah updated  kacau aplikasi myBCA,negatif
Saya Pakai Samsung S24 FE lalu membuat BCA ID dan setelah itu langsung saya Login tiba tiba keluar dari aplikasi atau Force Close  Why ,negatif
Saya baru update my bca  kenapa setelah di update waktu mau login malah keluar aplikasi terus  Kok habis di update malah jelek aplikasinya,negatif
Hbis di update malah sekarang logout2 sendiri baik itu msuk input password maupun pake finger  tetap ga bsa masuk  Sinyal full  Pakai WiFi juga sama saja ga bisa masuk ,positif
Tiba tiba tidak BS akses mybca Krn lupa update,negatif
Sayang sekali untuk android versi 14 merk OPPO kok gak bisa ,negatif
Hi Developer  setelah update apps tidak bisa di buka auto close terus ketika login  Saya sudah menggunakan versi terbaru 1 28 1 dan koneksi menggunakan home internet  Saya menggunakan myBCA latest version 1 28 1  bukan BCA Mobile saya rasa ini 2 aplikasi yang berbeda  Saya sudah uninstall tapi masih belum berhasil juga,positif
tolong perbaiki force close terus  jadi ga nyaman,negatif
Force close ckckkck,negatif
Dari kmrin aplikasi bca ga bsa dbuka baik my bca maupun mobile bca aplikasi slalu keluar dgn sndrinya tiap kali d buka  sangat kecewa sekali,negatif
Okk,positif
MYBCA sangatlah bagus bisa membantu bngtt ,positif
Habis update ga bisa login Langsung keluar sendiri,positif
Mantull dah ,negatif
Setelah di update  malah keluar sendiri terus  Jadi ga bisa dipakai,negatif
Hbs update malah close sendiri,negatif
Tidak bisa loging  aplikasinya berhenti sebelum loging,negatif
hadehh setelah update malah force close mulu,negatif
Setelah update app ke versi terbaru  aplikasi selalu force close  Setiap login baik pakai fingerprint atau password  langsung force close tolong segera di perbaiki  Hp saya realme 5i ,positif
Ribet juga yah  Harus photo ktp sam selfi foto pegang ktp  Pdahal udh ada datanya hadehhh,negatif
Ga bs masuk,negatif
sebulan 2x update tpi pelayanan gk bagus hadehh  gimna sih min,positif
Ini kenapa saya gagak download apk halo BCA ,negatif
Parah force close trus2x an  Gak profesional blasssss  Masih tetep tidak bisa di pakai disuruh reset password setlah ganti tiba2x aplikasi tertutup sendiri uda dicoba berkali2x tetep sama aja ,negatif
aplikasinya saat membuat id dan password bisa  namun saat proses login mengalami force closed  mohon untuk di tindak lanjuti,negatif
Sudah 2 hari ini aplikasi BCA Mobile   My BCA lgsg force close saat login ,negatif
Terima kasih BCA,negatif
Mau login harus masukin nomor telepon  Tp nyri kode negara indonesia gak ada  Gimna cerotanya bca ,negatif
Force close terus Nggak usah banyak alasan Jaringan saya bagus penyimpanan saya masih luas,positif
Sudah bagus  tapi kemapa di device saya  setting biometriknya udah hidup  tpi tiap masuk pakai biometrik  ada pesan   ups ada kesalahan ,positif
Susah banget mau masuk ke aplikasinya,negatif
Kok engga bisa di buka,negatif
Tdk bisa masuk,negatif
Ko keluar terus ya,positif
Aplikasi suka keluar sendiri  mohon di perbaiki,negatif
Gak bisa dibuka pas masuk langsung mental keluar  udah di reset tapi masih aja,negatif
Mantap,positif
Banyak fiturnya,negatif
Setelah update aplikasi sering nutup dengan sendirinya,negatif
Setelah update malah gak bisa masuk ke aplikasi  setelah masuk ID dan password langsung tertutup,negatif
Ini gimana   MBCA   My BCA Force Close semua   ada apa udah 2 hari   dateng ke Cabang di bilang emang lagi gangguan   lah ko gini amattt,negatif
Setelah di update force close  suruh di matikan Taklback dan assisten masih force close,negatif
Pindah ke MYBCA gara2 MBCA force close Padahal pake MBCA 10th aman2 aja  ganti2 hp pun aman  baru kali ini force close  Unisntall trus instal lagi sama aja  Sekarang MYBCA jg ke update otomatis jadi force close  padahal baru pake seminggu  Coba di hp lain aman2 aja  Taik lah lama2 bug versi android  yakali mau pake mbanking minjem hp anak Asw,positif
Force close terooos,negatif
Pendaftaran cepat mudah cs ramah semuanya the best  ,positif
Versi 1 28 1 tidak dapat login di Samsung a54 Mempersulit saya  Reset aplikasi sampai install ulang tetap tidak berpengaruh,negatif
Setelah update malah Ga bisa dibuka setiap ketik password keluar mulu  Kecewa,negatif
Mudah di gunakan,positif
Setelah diupdate  setiap saya akan login aplikasinya keluar sendiri  Sudah saya install ulang tapi masih seperti itu  Sudah chat bca tapi jawabannya cek secara berkala ,negatif
Oke,positif
Sejak update force close terus ,negatif
Sudah 2 hari tidak bisa di akses  setiap login selalu FORCE CLOSED sendiri,negatif
Tadinya BCA salah satu bank yang akses untuk disabilitas tunanetra baru tahun ini setelah diminta update aplikasinya sudah tidak akses lagi untuk penyandang disabilitas tunanetra yang biasa menggunakan dengan pembaca layar mohon diperhatikan kembali agar aplikasinya bisa berguna untuk kami penyandang disabilitas tunanetra,negatif
ini kenapa ya devlop  tadinya sudah balik normal kok sekarang kalo mau log malah keluar sendiri  force close sendiri apk nya  ada masalah apa sih sebenernya setelah di update malah gini  selalu deh setelah update pasti gini ada aja masalahnya  tolong dong,positif
Bagus dan sangat bermanfaat,positif
Good,positif
wajib update aplikasi terus  buat hp yg ram penyimpanan nya kecil  sangat disayangkan  ,negatif
dari bulan kemarin pas buka aplikasi gak masalah  pas di update kok habis login langsung mati aplikasinya  tolong di benerin ya ,negatif
Disuruh update tapi ternyata pas udah update gabisa login sekalipun hmmmm,positif
Setelah update selalu force close terus  Android 13,negatif
Force close  Reinstall  login  crash  force close ,negatif
Pripun Niki di update malah susah login Sampun ke cs cba tetep mboten saget malah bingung cs BCA ne Sampun telfon halo BCA tetep mboten saget Di update lagi wae yang mudah login nya seperti dulu,negatif
Sudah 2 hari tidak bisa masuk mybca  Force close sendiri terus menerus Kenapa ya kok skg sering bermasalah,negatif
KAK INI KENAPA APLIKASINYA HABIS MASUKAN SANDI TIDAK BISA DIBUKAAA  SAYA INI LAGI BUTUH MALAH APLIKASINYA EROR GINI,negatif
Sering keluar atau tidak mau masuk,negatif
Tambahin e wallet biar lebih ok  kendala skrng sehabis di update malah force close terus  Ga bisa digunakan   solusi ,positif
Setelah update gak bisa buka,negatif
Biometrinya enggak bisa di pakai,negatif
Kok gak bisa di buka,negatif
Kenapa jadi tiba2 tidak bisa login weh  Tiap login pasti mental aplikasinya balik ke home screen hp  Gimana ini weh ,negatif
Selama ini aman2 saja  Tapi per tanggal 22 Oktober begitu sy mau buka aplikasinya  aplikasi tab tiba2 FORCE CLOSE  berkali kali sy buka  uninstal  restart hp  masih tetap sama  Ini fatal sih  Fatal banget  Tolonglah BCA tolong perbaiki segera  Bikin sulit nasabah kalau gini ceritanya ,positif
Masih tetap tidak bisa,negatif
Kenapa sekarang setelah di update mlh sering mental ya ga mau masuk ke aplikasi nya  kata sandi di masukin bukan nya masuk mlh mental keluar  tolong di perbaiki lagi,negatif
Lagi gak jelas bca,negatif
Update versi terbaru malah gak bisa login  terpental terus  keluar dri aplikasi nya sendiri  tolong solusinya,positif
Sekarang tidak bisa membuka aplikasi myBCA  Selalu force close  Padahal kemarin kemarin bisa ,negatif
Knp akun my bca saya gbsa d buka masukin pasword g bisa masuk lgs keluar bgtu saja,negatif
Force close trussss  Padahal udah update  Mohon perbaiki dong  Ko kmarin enak enak aja  Nanti kalo dah bener di rating ulang deh  Blom ya  Kita udah gonta ganti jaringan lo  Wifi data sama aja  Udah bisa  Masalah di aksebilitas memang,positif
Knp gak bisa akses aplikasi  Selalu menutup sendiri saat login ,negatif
Kok dalam Minggu ini update sering,positif
Setelah Update Force Close Terus  jangan update klo malah jadi rusak aplikasinya,negatif
Verifikasi identitas selalu gagal pdhl sudah bener semua,negatif
Tidak bisa login   back terus  Internet sudah stabil,negatif
Mudah penggunaannya,positif
Jelek aplikasi nya relog mulu auto close buka rekening,negatif
Oke,positif
Mempermudah untuk keperluan pembayaran dan pengiriman uang ,negatif
Setelah di update Mala gak bisa dibuka,negatif
Agak laen aplikasi bca  Dihubungi ke cs by wa katanya gak bisa login aplikasi karna pakai wifi  Lebih stabil pakai jaringan mobile  Parah2   Padahal mobile banking bank lain bisa pakai wifi  Mana verifikasi berbayar  Padahal bank lain sudah digratisin  Perlu banyak improve ,positif
Kenapa gk bisa di buka yah,negatif
Suruh upgrade malah g bisa dipake  huuh payah   ,negatif
Force close after biometrics  i can t do transaction helppp  ini bca gak ada niatan buat fix kah  Masa habis update jadi sama sekali gak bisa dipake  udah gitu ngasih solusi yg gak solutif  Astaga ,negatif
Kenapa mybca sering banget harus di update sih   Gk kya bca mobile,negatif
Sangat membantu alhamdulillah,positif
Sangat sulit dan ribet hanya untuk mendaftar saja  Sudah ikuti semua step namun sistem gagal terus ,negatif
Sehabis update ko jadi ga bisa masuk ya  pas login langsung keluar sendiri,negatif
Kenapa habis diupdate malahan keluar terus pas masukkan password ,negatif
setelah update  kenapa setiap mau masuk selalu keluar dari aplikasi nya ya min  ,negatif
Aplikasi busuk udah seminggu ga bisa dipake,negatif
Oke,positif
Setiap transaksi pasti gagal tapi kalo hotspot ke temen baru bisa transaksi ini emng transaksi harus pake wifi kenceng apa gimana sih ,negatif
kenapa sering kali aplikasi myBCA tidak dapat dibuka ,negatif
min gmna c aplikasi id benar pasword giliran login langsung keluar z,positif
Sejak update terakhir tidak bisa log in  selalu terpental  tolong segera perbaiki,negatif
Aplikasi force close,negatif
Dear tim IT BCA  Baru tadi ini saya mendapat update tidak menyenangkan hingga menyebabkan aplikasi crash dikarenakan saya memiliki antivirus endpoint yang wajib di nyalakan di aksesibilitas  antivirus  remote desktop tidak dapat kami gunakan kembali  untuk itu dimohon ketika melakukan roll update agar di tinjau dulu di berbagai brand hp,negatif
Mantap,positif
Sudah berhari hari aplikasi force close  log in aja ga bisa  Udh ribuan nasabah komplain di IG juga tanggapannya template tidak ada solusi nyata  Kalau sampe ribuan orang yang komplain berarti aplikasi anda yang perlu perbaikan  Lama lama kok BCA jadi begini ya  Kecewa banget ,negatif
Habis install gak bisa dipake  force close,negatif
Kenapa mental mulu keluar pas pakai sidik jari,negatif
Update sistem aplikasi mybca  force close tiba2  Apa hubungan nya dengan aksebilitas wahai tim IT BCA ,negatif
Hallo kenapa ya my BCA ku mau masuk udh dimasukin kode keluar terus ngak bngt dah pake my BCA kemaren udh mintk otp udh masuk terus blom sehari mau masuk lagi keluar trs ngak bngt pokoknya,negatif
Ga bisa login,negatif
Kecewa  udah beberapa hari ini tidak bisa transaksi gara  disuruh update  malah jadi gak bisa login  sudah report ke halo BCA tidak ada solusi  begitu pun ke kantor cabang  malah suruh nunggu update an terbaru lagi  sampe kapannnnnn,negatif
Fitur pinjam uang dong pliss,negatif
1Minggu yang lalu masih bisa sekarang tbtb kalau apk nya dibuka gabisa langsung ngeblank hitam trus out dari apk,positif
Sangat memudahkan nasabah ,positif
BCA selalu Luar Biasa  emang ,positif
halo  setelah update kenapa aplikasi nya force close terus ya ,negatif
Gajelas tiba2 gabisa dibuka,negatif
Terimakasih bca,negatif
Maaf BCA udah mau tutup atau sedang mau kondisi Pailid   Aplikasi nya force close udah 2 hari ini  ,negatif
Suruh masukin nmr telepon tpi pilihan kode negara indonesia malah tidak ada ,negatif
Saya ps mau login tidak dapat nomor kode otp nya padahal pulsa sudah kepotong mohon di bantu terimakasih,negatif
aplikasi error force close mulu,negatif
Bagus,positif
segala nya jadi lebih mudah tingkatkan,negatif
Setelah di update kenapa nggak bisa dibuka ya  selalu force close padahal jaringan stabil dan baik  sudah dicoba menggunakan jaringan wifi pribadi tapi masih ajjah force close nggak bisa di buka ,positif
Semakin di update  semakin tidak bisa utk login dan keluar sendiri dari aplikasi  Payah aplikasi my bca ini  ,positif
Setelah update selalu Force close  dan hanya bisa login di hp tertentu saja   tolong kembalikan seperti biasanya,positif
Pengoperasian mudah  pembukaan rekening online pun mudah respon video call juga cepat  terimakasih,positif
Kenapa apps habis di update malah tidak bisa log in  dan langsung keluar sendiri di updatw bukannya makin bagus malah makin banyak Bug aplikasinya ,positif
aplikasi yg sebenarnya bagus  tetapi mengapa akhir akhir ini sering sekali ada pembaruan  belum seminggu diperbarui minta diperbarui lagi,positif
Saya sudah daftar BCA ID tapi sewaktu mau Masuk dengan BCAID dan Password nya  Aplikasi MyBCA selalu CLOSE sendiri bisa tolong dibantu mengapa demikian ,negatif
Cuma menghargai pembuat aplikasi aja  selebihan bikin kecewa,negatif
Sbelumnya baik baik saja tapi setelah di update ketika buka app masukan pin bukannya terbuka malah app keluar sendiri,positif
Update malah jdi force close,negatif
Bagus,positif
Gimana sih saya mau login  sudah masukkan nomor id dan password  lalu di suruh masukkan nomor tlp  kode negara indo malah ga ada,negatif
Ga bisa login gimana ini aplikasi di update makin rusak,positif
Setelah di update tdk bisa login,negatif
transaksi jadi lebih mudah,negatif
Sangat bermanfaat,positif
2 hari tdak bsa d pake buruk sekali,negatif
Lebih mempermudah layanan transaksi,negatif
Setelah di update malah gak bisa di buka  ,negatif
Wow terimakasih Akun BCA ku sudah bisa dibuka,positif
Aplikasi mental terus gak bisa di login,positif
Aplikasi utk android tidak stabil,negatif
Good app,positif
Habis di update kok malah ga bisa LOGIN  parah Kah  Gimana ini Mybca  Bukan membaik  malah BURUK  Masih belom bisa LOGIN,negatif
Force Close App nya  Mbanking juga sama  BCA sudah tidak aman kah ,positif
habis update malah ga bisa di buka  habis masukin sandi aplikasinya kluar sndri,negatif
Woeeee  gak bisa dibuka dari kemarin  Makan apa ini akuuu  ,positif
Versi terbaru  jaringan stabil tp ttp kluar aplikasinya,positif
Abis di updet 22 okt 24  Gabisa login,negatif
Woiiiii di update malah force close yang bener aja lah mending ga USA update update lah malah bikin susah orang Update kendala sampe tgl 23 Oktober 2024 tidak bisa teratasi bukan masalah aksebelitas tapi ketidak cocokan apk ke hp lama Samsung galaxy a50 dengan android 11   hebatnya tidak segera ditangani yang membuat saya terpaksa memindahkan semua tabungan saya ke bank lain serta mematikan qris BCA akibat ketidak profesional tim IT yang mengupdate aplikasi    ,positif
Masuk harus menggunakan pulsa padahal sudah terdaftar keluar masuknya harus ada pulsanya jadi masuk dobel paketan sama pulsa harus ada  Padahal lewat WA juga harusnya bisa tapi ttep pake pulsa  Tolong lah diperbaiki ,negatif
Aplikasi ini force close terus ya  tidak bisa dipakai tiba tiba  Padahal sebelumnya masih bisa dipakai  Bisa segera diperbaiki  ,positif
Habis update kenapa gak bisa buka apk ya  Apa ada yg salah,negatif
maaf kak kenapa yaa ga bisa masuk ke app nya setiap kali masuk malah langsung keluar otomatis,negatif
