clean_text,sentimen
tiba tiba nomor saya terblokir tidak bisa masuk ke nomor yang sudah terdaftar dan tidak bisa menambahkan nomor baru karena tidak ada pilihan kode negara indonesia di fitur tambah nomornya  ribet,negatif
gercep sii miminnya baik ramah pelayanan juga ga kalah dehh,positif
ios 17 3 FORCE CLOSED SUDAH DICOBA DI BEBERAPA IPHONE DENGAN IOS YANG SAMA JUGA TETAP FORCE CLOSED  TLPN KE HALOBCA KATANYA AKUN TIDAK ADA KENDALA,negatif
BCA gak pernah ngecewain  selalu puas ,positif
"Entah kenapa setiap app ini di update dari masalah crash wkt masukan pin transfer sampai sekarang update baru malah crash terus tiap buka app  Developer nya jauh kalah sama mandiri  Ga bakal lagi update  makin update makin rusak 

15 pro max force close ",positif
Tdk bisa daftar karena Sudah ada ID  Padahal belum sempat masukan nomor HP  ,negatif
Gimana si min ini kok BCA ngga bisa lihat mutasi uang masuk dr rek lain ya  cuma ada riwayat uang keluar sja  bahaya bgt ini,negatif
Udah coba kirim otp udah dimasukan sesuai lalu disuruh verifikasi data nasabah giliran udah selesai di isi disuruh ngulang lagi hampir seharian ngulang gak masuk masuk  Saya coba ganti hp untuk login sama aja ngulang mulu,negatif
Error terusss,negatif
"Aplikasi yg sangat berguna
Visinya bagus  namun eksekusinya masih bisa ditingkatkan lagi
Sering terjadi lag  untuk perusahaan perbankan seharusnya hal seperti ini bisa segera ditangan oleh pihak developer
Overall good app",positif
Bukan jaringan saya yg jelek  sy sdh cba apk bbrp kali ttp oke  Tp saat buka mybca hadeuh muter2 doang  Mana dana saya udah masuk situ dan mengendap 50rb jd sayang klo gini caranya,negatif
Sebetulnya nyaman sekali pakai app ini  tapi kenapa tiap mau liat saldo tiba tiba session expired dan diminta untuk login lagi   ,positif
Gangguan mulu ah malu maluin mau bayar qris gabisa bisa jadi bikin ngantri,negatif
Secara Overall ini sangat membantu sekali dalam transaksi apapun  hanya saja banyak sekali bugs untuk user yang pakai Iphone dari type 11 ke atas  so jadi please update khususnya untuk Virtual Account selalu Force Close ketika di ketuk ,positif
Gabisa tf sering banget kejadian begini,negatif
Aplikasi selalu force close ketika akan melakukan transaksi transfer ke Virtual Account  Tolong segera diperbaiki  Karena ini sangat mengganggu dan merugikan ,negatif
The server is so bad  it cannot process the request quickly,negatif
Topup flazz suka gagal  harus telp cs buang2 waktu,negatif
very bad always back again to creat the id over and over again ,negatif
Astaga eror terus sering bgt scan qris gagal tp kedebet ,negatif
Aplikasi tidak bisa di buka di iphone 11 pro saya,negatif
tiap mau login hrs pakai pulsa  bbrp ribu utk dpt sms verifikasi,negatif
Aplikasi super lemot  padahal internet lancar 5G buat buka ig dan sosmed jg lancar  cuma mybca aja loading ny seabad  udah gitu sering bgt eror transaksi,positif
Perbaiki lah ini bug2 nya  lemot sekali  kadang crash  kadang bs ke putus  pake Mbca lancar padahal,positif
aneh bgt pelayanan bca,negatif
Awalnya gabisa scan QRIS  pas reinstall malah gabisa verif muka sama sekali,negatif
"ga se friendly mbca 
  in app notif bar  udh di klik masih ada merah2 nya   gw kudu baca 1   1 gitu info nya   
  kalo ngelakuin pembayaran   cashflow notif pop up nya double  for what   
  kayaknya kalo trf masuk masih gak ada notif nya  padahal itu notif yang bikin orang happy  
  kalo buka app nya suka berat dan lemot di awal  even when connection fine tho  like  yo is bank apps need really good chipset   
  gak support dark mode  what in the world  now we at ios 17  really  ",positif
adain riwayat pemasukan secepatnya,negatif
Error terus,negatif
Jujur dari desain interface bahkan lebih jelek dari Mobile BCA  Pun performanya lamban  Aplikasinya sangat jauuhhhh sekali ketinggalan dibanding mobile banking jaman sekarang yang desainnya oke namun performa tetap gesit  Sebenarnya fokus aplikasi MyBCA ini apa  Bahkan cek mutasi hanya 31 hari  Icon menu seperti 2015  Bank swasta nomor 1 di Indonesia masa begini sih  ,positif
Verifikasinya susah gagal mulu katanya suruh pakai paket data udha ganti dr Wi Fi ke paket data ttp gagal terus disuruh restart HP juga  Udah aku lakukan sesuai intruksi pakai paket data  restart HP tp ttp aja gagal terus verifikasinya sampai habis pulsa banyaj,negatif
"Dear tim developer BCA  Terimakasih karena Aplikasi ini udh membantu banget buat kebutuhan transaksi harian  Great job  

Sedikit inprovemnt dibutuhkan pada section transaksi pembelian pulsa listrik  PLNPRABAYAR  mgkin bisa ditambahkan fitur save nomor ID PLN Pelanggan atau Paste di kolom  ID PELANGGAN agar lebh memudahkan transaksi jika tidak sedang mengingat nomor ID PELANGGAN atau jauh dr meteran  

Karna yg saya dan mgkin sbgaian besar pengguna rasakan saat ini cukup kerepotan saat ingin brtransaksi namun tidak ada contekan nomer ID PELANGGAN  

Terimakasih  Sukses terus tim MyBCA ",positif
ribet,negatif
Upgrade dr aplikasi bca mobile  Tapi repot bolak2 kirim otp mulu  boros pulsa  Akhirnya back to bca mobile ,negatif
Btw min gemana cara save e statement yg bahasa Inggris  karena di aplikasi saya slalu bahasa Indonesia filenya,negatif
Kenapa yaaa  tiap login harus face recognition lagii  OTP lama banget masuknya  udah gitu gagal terus  padahal mbanking bank lain ok2 aja  perform vidcall gak tersambung2  nunggu lama muter2 ajaa  huhu why bca why ,positif
lama sekali nunggu cs buat video call,negatif
Mau diganti jaringan pake wifi  pake paket data 4G tetep aja lamaaaa banget prosesnya  Mau login pake face ID di iPhone 11 aja juga lama banget padahal pakai aplikasi bank lain cepet lho ,positif
Karena berdekatan dengan galeri,negatif
pls adakan fitur login pake wa  soalnya kalo sms hp aku ga bisa exinter ,negatif
"Untuk semuanya sudah lebih dari cukup 
Hanya saja tolong ditambahkan fitur untuk menghapus daftar transfer bulk atau banyak sekaligus dalam satu waktu 
Sekarang baru bisa hapus satu per satu  Dan itu masih terbilang ribet  Mana harus masukin pin lagi 
Memang fiturnya tidak terpakai setiap hari  tapi ada kalanya user ingin merapikan daftar transfer sesekali  
Kalo di m Bca sudah bisa di lakukan di menu admin  Kalo disini belum bisa 
Semoga menjadi masukkan untuk dev  ",positif
udah 2 kali gbsa login my bca  id tiba2 hilang  face id gbsa login  padahal ga di reset  update atw apapun,negatif
Min tolong dong perbarui lagi  my bca saya selalu mental gabisa di bisa applikasi nya,negatif
Tlong perbaiki ASAP  uda 1 mingguan ga bs topup n byr an melalui virtual account ,positif
verifikasi wajah masa gagal trs  mau pindahin ke device baru jadi terhamba  sama aka kaya mbankingnya gagal trs verifikasi wajah gajelas,negatif
Pada notifications bisa ditambahkan fitur read all kah  Memudahkan user untuk memanage notifications,negatif
Masa sekelas BANK BCA ga bisa buat notifikasi uang masuk,negatif
Susah banget mau daftar ny  hp udh restart  pas klik lanjutkan gak warna biru jd gak bsa di klik,negatif
"Suruh kirim kode otp waktu batas pengisian 1 menit kode otp dikirim 55 detik kemudian kocak
APLIKASI SAMPAH",positif
Nyesal pakai my bca yang ini saldo di potong terus biaya admin semalam di potong sekarang pagi di potong lagi,negatif
Tolong my bca untuk iphone ada bug  ketika akan melakukan transfer virtual account aplikasi selalu force close,negatif
"kenapa ya di my bca saya kok hape nya harus di kasih pasword  Bagaimana cara setting nya agar bs mengakses my bca tanpa hape nya dikasih pasword   pola sandi 
tolong info nya",negatif
Akun sempat ke logout  sudah login dan diminta OTP tidak ada yg masuk sampai pulsa habis  sudah kontak halo BCA katanya tidak ada masalah sistem atau akun dinyatakan aktif  hanya diminta coba login  tapi tetap tidak bisa  ulasan tidak akan di ganti sampai masalah ini selesai,negatif
Crash setelah update ke 1 24 0 di ip13 ios 16 6 1 please fix the crash,negatif
Selalu gagal di verifikasi KTP dan FR  Pdhl sudah foto ektp asli dan selfie di tempat terang ,positif
Ribet bgt login gagal muluk  ampun dah,negatif
sudah beberapa kali saya masuk dan tiba2 dia error dia minta login akun  saat saya login malah meminta untuk telfon lg bca  sudah kejadian beberapa kali  tolong di rapihkan lg aplikasinya,positif
tolong  untuk ditambah fitur riwayat uang masuk  sayang sekali kalo fitur itu belum ada,negatif
Makin kesini error makin rutin top  ,positif
Permisi  tolong  Hadirkan fitur Qris sumber dana dari kredit card ya  Terimakasih,negatif
"setelah update ke versi 1 24 0 jadi force close tepat setelah app di jalankan  solusinya downgrade ke versi 1 23 0

sebaiknya developer sebelum melakukan upadate ke 1 24 0 melakukan pengecekan terlebih dahulu apakah user iphone ios 15 8 2 bisa menjalankan myBCA 1 24 0 atau tidak",positif
ke logout tibatiba dan selalu error kalau mau login  solusi yang dikasih juga gak ada yang berguna karna tetep gagal  telfon cs di pertengahan malah dimatiin,negatif
Masih slow menurut saya pas update2 terakhir makin agak lemot apps nya,negatif
Masa bca id udah 2 kali ke blokir  Padahal mggak pernah salah password  Kan jadi males ngurus  males buka jadinya ,negatif
pdhl sdh ke CS sdh reset jg  ttp aja g bs login  ,negatif
app crashes whenever you try opening it,negatif
Mana OTP code udah 2x resend gak masuk2  Pulsa masih banyakkk,negatif
Buang buang pulsa buang buang uang mau pindah akun ke hp baru aja harus habis pulsa 50an tetep aja gabisa ih njs di persulit bgt bca terlalu bgt,negatif
latest version 26 june 2024 crash when opened,positif
Setelah update versi terbaru selalu gagal utk QRIS keluar pesan coba ulangi utk diphone 14 pro  tolong perbaiki kalau ada bug pd Qris  lainnya aman ,positif
"Mantap aplikasi myBCA atas fitur barunya yaitu terblokir otomatis setiap minggu sehingga harus ganti password sampai kehabisan ide harus mikir keras buat password baru 

Pertahankan terus fiturnya sehingga orang orang kembali menggunakan mBCA yang lebih simple dan superior ",positif
Ayoo  tinggal tap to pay contacless payment dr tabungan atau cc  kalahin mandiri ,negatif
BCA gak pernah mengecewakan dari aplikasi  pelayanan smpai call centernya  ,negatif
Sumpah deh ini muter mulu loading lama betul ,negatif
"mau bayar buat isi bensin tau2 aplikasinya eror  sekarang saya terdampar di pom bensin entah sampai kapan

good job BCA  ",positif
Terlalu lambat  Bank besar sekelas BCA,negatif
Versi terakhirnya super lemot  Login aja lama bgt ,positif
"Kecepatan aplikasi memuat halaman terbilang cukup lambat  Jika dibandingkan dengan Mobile BCA masih lebih cepat Mobile BCA 
Aplikasi ini untuk bayar QRIS lambat banget responnya  

Belum lagi ID saya kalau sudah beberapa waktu tidak login   lalu login kembali tiba tiba terblokir ",negatif
saat login nya lama  saat mau transfer cari list nama yg mau di trf juga lama loading nya beda dengan bca mobile  segala sesuatu cepat di aplikasi tsb  padahal mulai memyukai memakai MyBCA tapi loading nya lama utk aplikasi banking Tolong diperbaiki developer BCA,positif
Isinya error terus sebulan ada lbh dr 5x   lebih sering dijaga napa masa mbca aja gapernah error,positif
setelah Update Akun sekarang sering keluar keluaran dan error  kecewa berat  tolong engineer Nya bca Pecat saja,negatif
Hari ini busuk bgt  Berkali kali crash dan loading super lama entah mengapa  I m on iPhone 13,negatif
Jelek banget tiap cek saldo logout sendiri app nya  udah gitu loading data nya lama  Beda sama yg m bca jadul  Cpt delivery data nya,negatif
"Tiap mau login id disuruh masukin no hp ama rekening padahal udah   nanti disuruh login lagi balik lagi disuruh isi no hp gitu gitu terus
Harap di perbaiki bug nya",negatif
Dikit dikit pulsa kocak banget dah,positif
kenapa gak dijadikan satu aja semua di satu aplikasi ,negatif
Nyoba daftar apk  ini dari tahun 2022 sampe skrng th 2024 gagal mulu  ga bisa2 heran sampe tlp CS pun gabisa2  niat bikin apk yang gampang dikit kek  ribet bangett sumpahh bikin malessss plus emosi aja,negatif
kalau aplikasi blm siap gak usah di playstore kan  kamera jelas dll tp gak bisa verifikasi wajah,positif
"Saya tiba tiba terlogout dari aplikasi mybca 
Solusi dari halo bca untuk delete bca id dan buat bca id baru 
Setelah dibuat bca id baru  malah tidak bisa dihubungkan ke no rekening dan nik 
Aplikasi yang buruk ",negatif
aplikasi perbankan paling buruk dan ketinggalan zaman,negatif
saya salah memasukkan password malah id bca keblokir dan disuruh telpon di nomor yang tertera di aplikasi  saya coba menghubungi via whatsapp tetap di arahkan di nomor yang tertera dan petugas yang membalas chat saya di whatsapp katanya telpon tidak memungut biaya  dan saya mencoba telpon di nomor yang tertera tetap memungut biaya pulsa dan belum berhasil sampai sekarang  padahal nomor kartu atm saya sudah sesuai,negatif
Saya mencoba reset password akun dengan nomor by U berisi pulsa 18k tapi tidak dapat dilakukan  Saya menunggu semoga pihak BCA mau bekerja sama dengan provider tsb untuk kenyamanan dan fungsional pengguna app nya  Terimakasih dan maaf,negatif
Tolong segera di haridakan dong untuk informasi pemasukan saldonya  jadi kita sebagai user langsung bisa melihat total dana masuknya selama ini  Dan kalau bisa tolong tambahin fitur untuk top up e walletnya seperti dana  shopee pay  gopay dll  Untuk mempermudah kita sebagai user dalam melakukan transaksi top up melalui aplikasi my BCA ,positif
Cape harus login trs logout trs sedangkan login harus pake pulsa jadi cape juga lama lama  setiap login susah ke amanan telah di perbarui trs gitu aja ribet gak lagi pake my bca nyebelin enak pake face id cuman log out terus sekarang sekarang mending m bangking ajalah lagi  kaya cape login trs pake pulsa lama lama,negatif
Overall ini aplikasi udah bagus  interface nya nyaman dan attractive  untuk melakukan transaksi juga begitu mudah  masukan saya pada My BCA atau Bank BCA diharapkan kedepannya support apple pay apple wallet atau adakan kartu digital agar lebih memudahkan transaksi hanya dengan tap to pay via handphone jadi tidak usah bawa kartu debit fisik  hanya dengan tap handphone ke mesin edc bisa transaksi,positif
"Notifikasi masih ada padahal di applikasi semua tombol tidak di posisi rata kanan  
Tolong di perbaiki  Dan tingkatkan yg sudah baik  Terimakasih ",positif
Terlalu banyak aplikasi  jadi binggung mau pake mobile banking apa my bca ,positif
Harus update mulu tiap minggu  Kalo belum kelar  kelarin dulu jangan satu2 gini dong ah,negatif
tolong updatenya utk ios 12,negatif
Gangguan terus,negatif
Sering error,positif
Apasi error trs mau login di suruh coba lagi,negatif
Untuk sekelas Bank BCA  my BCA sangat BURUK kualitasnya  Baru pemakaian 3 bulan tp ntah berapa kali diminta re log in dengan penggunaan pulsa  Bahkan ketika kendala dan lgsg ke CS Walk In nya tetap saja hrs menggunakan pulsa  harusnya klo nasabah udh effort sampe dtg ke kantor ya bisa diselesaikan tanpa harus keluar biaya lg dong  Udh digitalisasi tp kamu mengecewakan sangat mendalam  Segera akan saya tutup rekening bank konvensional ini ,negatif
Selalu Muncul tulisan  Your MyBCA sekuriti have Been update Please login Again ,negatif
Tiba tiba tidak bisa masuk karena mybca security has been updated ,negatif
Login aja susah  padahal jaringan lancar mau transaksi gak bisa,negatif
Aplikasi sampah ,negatif
App sering kali tdk dapat digunakan,negatif
Udah bisa login ke id tapi pas setelah masukin no rek sama nik ktp gak bisa di ceklis dan lanjut ke step berikutnya  Emang keknya lbh nyaman pake mobile bca sih,positif
aplikasinya suka eror tiba tiba ke log out sendiri harus login fengen cerifikasi sma yang nguras pulsa  login pake nomir hp otp nya ga masuk masuk  parah ,negatif
Terlalu banyak bug,positif
Kenapa ya fitur Paylaternya tertulis something went wrong  please try again dan ini sudah berlangsung berhari hari,negatif
Halo  sedikit masukkan  tambahin copy button untuk menyalin token yg ada 20 digit saat beli token listrik  Ini diperlukan saat saya beli token untuk orang dirumah  saya tidak perlu repot2 mengnyalin secara manual  trims ,positif
Aneh banget  no ke blokir gara2 beda no hp  Pas mau ganti ke no yg di pakai  tidak ada pilihan negara Indonesia  GIMANA MAU VERIFIKASI   TOLONG PERBAIKI SECEPATNYA ,negatif
ini bagus banget  aplikasi yang paling ngebantu buat yang punya dua rekening tapi salahsatu sim card hpnya hilang  ,positif
Versi 1 23 0 penambahan OTP untuk telepon Singapura tidak bisa  kenapa di versi ini tiba2 country code Singapura tidak ada   Apakah di remove   Country yang lain ada  tolong di add kembali ,negatif
Aplikasi nya bagus tapi beberapa minggu kemudian harus login lagi pake id pass  tombol face id ilang  trus login pake otp dan pake pulsa  padahal ga pernah di logout  berkali kali kaya gitu ngabisin pulsa  asli aplikasi aneh  TOLONG DI PERBAIKI,positif
"Gagal Login terus  sudah sukses Connect semua akun  tiap mau Login disuruh tambahan nomor lagi dan OTP lagi  potong pulsa lagi  Sukses  begitu Login kayak itu terus 

GA JELAS",positif
Tiap kali mau transaksi di mybca selalu langsung ketutup apps ny,negatif
Akhirnya myBCA pensiun dari gadget ios 12ku,negatif
Tidak ada fitur nutasi rekening realtime seperti mbca  mau lihat mutasi harus menunggu sampai penghabisan bulan ,positif
Udah lengkap  Tapi udah beberapa kali tiap mau bayar di kasir saya jd malu karena loading nya lambat sekali  Akhir nya saya balik bayar via BCA mobile yg lama ,negatif
Good,positif
Tolonglah jangan sering diupdate  Ios handphoneku ga support buat buka aplikasinya huhu  Minimal ios 13 pusiiing,negatif
Bisa x aktifkan qris dengan bayar pakai cc bca nya   fiturnya,negatif
Bikin yg support iOS dibawah versi 13 dong,negatif
aplikasinya sudah mudah untuk digunakan  sarannya tolong berikan tambahan fitur untuk isi ulang e wallet yang berbeda dengan transaksi virtual account karena prosesnya jadi lebih panjang,positif
"Solusi dari CS BCA gak ada yg berhasil 
Bilang koneksi wifi lah  data kartu lah  suruh matiin hp  cabut kartu  sama aja  Gagal 
Hasil speedtest Koneksi wifi 40mbps  koneksi dari kartu hampir 60mbps ",negatif
"Ketika saya update ke versi 1 22 0 Aplikasi langsung force close ketika kita akan search rekening nama bank dengan cara di scroll ke bawah  

Untuk versi ios saya sudah pakai versi terbaru di 17 5 1  

Tolong untuk di perbaiki bugs ini ya  
Terima kasih ",positif
selalu ke log out tbtb disaat butuh  tpi pas masukin id dan katasandi minga veriv ke no hp lama bgt ga masuk OTPnya  sampe kudu nunggu bermenit2  better m banking ,positif
Luar biasa,positif
Bisa tambah fitur buat misahin uang uang kita yg ada di rekening ga  Supaya gampang manage uang nya,positif
Masih perlu pengembangan terkait pembayaran kartu kredit,negatif
Mohon add utk BPJS TK BPU tidak ada di menu payment  padahal di mobilebca ada  Jd sementara pindah ke mbanking kuning sebelah dulu deh,positif
"Bagaimana cara donlot applikasi versi sebelumnya  HP saya IPhone 6 
Terima kasih  ",negatif
"1  Arus Dana Masuk tidak bisa di cek  bahkan tidak di record di aplikasi ini 
2  Mutasi Rekening tidak bisa di akses harian ataupun real time  Harus nunggu tanggal 1 dulu untuk melihat Mutasi Rekening 1 bulan kebelakang ",negatif
Akhirnya aku putuskan beralih dari bca mobile ke mybca  lebih enak UI nya lebih mudah penggunaanya  Thanks BCA,positif
Cuma agak lelet kadangan suka keluar sendiri ,negatif
Biar aja dibilang ribet  repot  ganti device harus verifikasi ktp  verifikasi wajah  dll  saya yakin itu semua demi KEAMANAN nasabah  Cb bayangin kalo registrasi  aktivasi  dan pindah device dibuat gampang ya bakal gmpang kebobol oleh hacker lah  klo udh resiko finansial baru tau rasa ,positif
"Tolong dong admin  untuk pengguna ios dibawah ios 13 karena nggak bisa update jadi nggak bisa buka app 
Padahal udah nyaman pakai app ini",positif
Sangat sulit untuk verifikasi data ,negatif
Untuk IoS versi iphone 6  Saat ini sudah tidak dapat digunakan  setiap kali membuka aplikasi dan login selalu saja minta pembaharuan namun tidak sapat dilakukan,negatif
Update versi terbaru memerlukan iOs v 13 0  Sedangkan hp sy udah mentok iOs nya di v  12 5  Transaksi di MyBCA tidak bisa dilakukan  karena aplikasi harus update,positif
"Tadinya udh gk ada masalah dari versi2 sebelumnya  Update ke versi terbaru 1 22 0 mulai crash lg wkt mau transfer virtual account  Begitu pilih virtual account lgsg crash  Keluar aplikasi  Tolong perbaiki secepatnya  Saya banyak transfer ke virtual account soalnya 
Terima kasih",positif
tolong adain fitur keyboard bca seperti mobile banking bca dong,negatif
Tambahkan cek fitur mutasi harian donk  masa tiap mau cek mesti nuka bca mobile yg lama ,positif
Kalau lama gak di pake  mesti login lagi  sms lagi  masukin nomor kartu atm lagi  ribet  mending m bca,positif
Kemudahan yg sangat membantu  Mungkin karena masih under development jadi fitur fiturnya belum lengkap  Tapi sejauh ini sangat mudah digunakan  Terimakasih BCA,positif
Saya berharap qris bisa link juga ke kartu kredit karena ribet keluarkan kartu kredit untuk bayar ,negatif
Fitur yang friendly user buat kaum milenial  Tampilan yg simple dan mudah di mengerti ,positif
Karna punya bbrp rekening BCA dulu harus pake web buat tf  sekarang pake satu app ini jadi praktis  Terbaik sih emg  ,positif
Tambahkan fitur Nama Alias pada setiap nomor rekening yang disinkronkan di akun  Cek PLNMobile tuh,negatif
BUG myBCA Versi 1 21 0 ketika buka app force close sudah di fix di versi 1 22 0   Good lah walaupun lama fix nya sebulan lebih baru di update  ,positif
Sejak apps welma digabung  Fitur welmanya masi kurang bgt  ga kaya aplikasi reksadana pada umumnya  Pilihan buat laporan pajaknya juga ga ada ,negatif
Coba di buat klo ada pemasukan N pengeluaran ada notifnya,negatif
1 aplikasi utk semua kebutuhan di bca  sangat membantu  ,positif
Maaf harus bintang 1 karena aplikasinya suka error  freeze dan sering lemot ketika membuka  Mohon diperbaiki  Terima Kasih,negatif
The Best,positif
Akun saya hbs kena bobol org 700 rb,negatif
Mau pake harus update segala ribet,negatif
Better dari pada m bca dan klikbca  lebih easy to used  ada pilihan bahasa juga  login face id fingger juga ada  bisa buka deposito  beli reksa dana obligasi  bisa ajuin paylater juga,positif
Update baru ga bisa di iphone 6  Tolong kompatiblenya dibenerin ,positif
Jangan sering update gitu dong menuhin memori hape,negatif
User friendly tampilan lebih asik  Simple dan ga bikin ribet  Kalau bisa free admin sepeeti bank tetangga donk ,positif
Untuk keseluruhan sudah ok  cuma untuk notifikasi menerima dana tidak muncul  jadi kita tidak tau ada transfer an dana dari kerabat atau tidak  jadi harus ngecek mutasi rekening dari siapa pengirim dana tersebut,positif
ngerasa lemot deh aplikasinya,negatif
Engga jelas anjir  Mau daftar aja ribet banget  bikin ID gagal mulu  Sekalinya bisa  aktivasi nomer hp yg gagal mulu  Padahal pulsa ada buat kirim sms  Ribet banget  Perasaan daftar aplikasi bank lain gampang2 aja ,negatif
Versi sebelumnya berjalan lancar  cuma versi ini terlalu lambat  Login  bayar menggunakan QR selalu loading panjang  Padahal sinyal full bar ,positif
"Otp di My BCA kenapa sih ga dikirim2 otp nya  ditungguin sampe 1 jam tetep ga muncul  udhmah registrasi My BCA Konfirmasi nya pake pulsa lagih
udh gitu dibuat nunggu lama hadeuhhhb",negatif
Pengen unused aja,negatif
Baru mau bikin ID aja udah gak bisa mulu  responnya  email sudah digunakan  padahal gak pernah pakai email untuk bikin bca ID  Sekalinya bikin email baru  bisa sih bikin ID  tapi ga bisa registrasi kartu karena katanya  nomor sudah digunakan   Padahal nomor cuma 1 dan gak pernah masuk myBCA sama sekali  Aplikasinya jadi gak berguna sama sekali  Log in aja gak bisa  gimana mau digunakan,negatif
Padahal username sama password udh bener tpi malah muncul pesan  terjadi kesalahan ,negatif
Sering bgt eror skrg payaaah pdhl mbanking andalan  ,positif
Update terbaru mei 2024 jadi lambat  Tidak seamless rasanya  Akhirnya kembali pakai mobile BCA,positif
sebel bgttt lola bgtt pas mau ngek saldo di mybca tolong diperbaikin ka,negatif
Ini gimana sih apk nya lemot bener padahal sinyal enak  barusan buka brimo masih enak tuh transfernya giliran di bca yaampun harus sabar banget,positif
"Loading lumayan lama
Minta di update mulu app nya
Sering error saat lagi urgent di butuhin",positif
unreliable  laggy af  not working when needed most,positif
The app keeps loading every time I open it  It s hard when you want to do a transaction  It crashes and sometimes takes forever to move to the next menu  Please fix it,negatif
kenapa lemot si,negatif
di update malah sering eror,negatif
"aplikasi ampas   buat cek saldo   mau topup VA aja susah 
wifi dirumah 60mbps padahal",negatif
sekelas dev bca bikin aplikasi busuk kaya gini kah  sering bgt error pas mau buka aplikasi nya   hari ini tgl 31 05 2024 jam 12 56 mau cek mutasi aja gabisa  ,negatif
Apps nya suka lemot dan error  Compared to BCA Mobile dan BLU BCA  app MyBCA performanya agak kurang ya ,negatif
"gajelas sering bgt eror nya  
apalagi kalo setiap akhir akhir bulan lagi ini aplikasi eror nya",positif
Bener2 parah aplikasi error di jam penting sperti ini  Jumat jam 13 51,positif
Kenapa sering error sih  padahal koneksi stabil,negatif
Keg taik   Eror mulu   Ga ngotak,negatif
najis aplikasi nya sering down  bermasalah trs  sampe ke blokir beberapa kali  benerin dong masalah servernya  supaya ga meribetkan orang,negatif
Mau login aja lama amat  Gonta ganti apps buat apa  Yg penting simple cepet malah bikin rumit ,positif
Percuma fiturnya lebih banyak  kalau jadinya lebih lambat  Transfer   cek saldo aja lama banget dibanding m bca,positif
Mohon untuk info cashflow PEMASUKKAN segera diupdate  pengguna mau tau brp pemasukkan setiap bulan nya  Selebihnya Aman  Thanks,positif
padahal koneksi kenceng tapi loading aplikasi parah banget lemot nya,negatif
Di email sudah berhasil tapi dilogin gak bisa  Aplikasi produk gagal ,positif
